{
  "schemaVersion": 1,
  "id": "development-extended",
  "name": "Développement étendu",
  "description": "Outillage supplémentaire pour Python, Rust, Go, LLVM, IDE et développement Minecraft/modding.",
  "components": ["github-cli", "visual-studio", "flutter", "notepadpp", "powertoys", "vscode", "intellij-community", "python", "rustup", "go", "llvm", "temurin21"]
}